{
  "action_shadow_bridge": {
    "authority": "A84",
    "bridge_closed_at_regime_local_action_tier": true,
    "full_matching_completeness_closed": false,
    "full_nonlinear_physical_action_closed": false,
    "profile_identification": "chi_s(x)=exp(-s x)",
    "rule": "the selected repair kernel enters the coherently reduced regime-local action through its finite overlap or trace",
    "semigroup_alone_would_select_action_profile": false,
    "uninserted_scalar_trace": "Tr exp(-sK)=Tr chi_s(K)"
  },
  "check_summary": {
    "failed": [],
    "passed": 74,
    "total": 74
  },
  "checks": {
    "A53_measure_was_not_selected": true,
    "A53_minimal_support_was_not_promoted": true,
    "A84_action_shadow_bridge_is_explicit": true,
    "A84_branch_order_is_448": true,
    "A84_fixed_point_semigroup_is_proved": true,
    "A84_gap_is_15": true,
    "T24_finite_charge_is_Dphys": true,
    "T24_finite_factor_is_qF": true,
    "T24_source_is_exact": true,
    "T24_square_contains_same_Dphys_squared": true,
    "T24_total_charge_contains_same_Dphys": true,
    "T25_source_is_exact": true,
    "T28_boundary_is_exact": true,
    "T28_operator_space_nogo_is_preserved": true,
    "T30_coordinate_matches_exact_q13": true,
    "T30_determinant_is_on_same_Dphys": true,
    "T30_selector_is_exact": true,
    "T32_action_is_exact_at_declared_tier": true,
    "T33_freeze_is_exact": true,
    "T33_no_double_variation_is_closed": true,
    "T33_preprojection_map_was_open": true,
    "T33_same_root_map_was_open": true,
    "absolute_scale_remains_open": true,
    "clock_certificate_passes": true,
    "clock_lift_remains_conditional": true,
    "contract_schema_is_exact": true,
    "full_four_dimensional_determinant_remains_open": true,
    "full_upper_source_remains_open": true,
    "h_value_matches_T33": true,
    "handoff_is_pinned": true,
    "kernel_model_is_pinned": true,
    "minus2_value_matches_T33": true,
    "minus4_value_matches_T33": true,
    "moment_ratio_is_positive": true,
    "nine_yukawa_values_remain_open": true,
    "no_fitted_coefficients_used": true,
    "no_observed_values_used": true,
    "one_atom_measure_is_newly_closed_at_declared_tier": true,
    "physical_clock_upper_derivation_remains_open": true,
    "physical_packet_acceptance_unchanged": true,
    "physical_row_acceptance_unchanged": true,
    "plus2_value_matches_T33": true,
    "point_measure_has_zero_variance": true,
    "positive_laplace_measure_is_unique": true,
    "precision_transport_remains_open": true,
    "promoted_values_are_strictly_positive": true,
    "promoted_values_have_strict_order": true,
    "radial_mass_is_positive": true,
    "radial_moment_ratio_is_newly_closed_at_declared_tier": true,
    "rank_one_Hankel_identity_is_symbolically_zero": true,
    "same_root_diagram_is_newly_closed": true,
    "sector_map_remains_open": true,
    "selected_gap_identity_is_certified": true,
    "source_01_hash_matches": true,
    "source_02_hash_matches": true,
    "source_03_hash_matches": true,
    "source_04_hash_matches": true,
    "source_05_hash_matches": true,
    "source_06_hash_matches": true,
    "source_07_hash_matches": true,
    "source_08_hash_matches": true,
    "source_09_hash_matches": true,
    "source_10_hash_matches": true,
    "source_11_hash_matches": true,
    "source_12_hash_matches": true,
    "source_lock_schema_is_exact": true,
    "source_root_is_nonempty": true,
    "state_generator_is_positive_square": true,
    "state_heat_profile_is_newly_closed": true,
    "state_semigroup_has_composition": true,
    "state_semigroup_is_contracting": true,
    "state_semigroup_is_unique_by_spectral_theorem": true,
    "tau_interval_contains_A84_value": true,
    "theorem_is_nonempty": true
  },
  "claim_id": "CBF.T34",
  "date": "2026-08-30",
  "frontier_delta": "CBF.T34 closes the same-composite-root map from the T24 finite differential to the T30 determinant selector and from the same total charge to a state-space heat profile. The canonical quadratic closure functional uniquely generates exp(-s B_tot^2/Lambda^2), whose only positive Laplace measure is delta_s. At tau_int=log(448)/15 this derives f2/f0=15/log(448), removing A53's minimal-support premise and promoting the T33 nonzero cutoff-unit radial values at the declared finite direct-source/internal-checkpoint tier. The T28 operator-space no-go is preserved. Full upper source selection, physical clock lift, 4D determinant, absolute scale, nine-value particle map and precision transport remain open, so physical endpoint acceptance stays 0/3 and 0/7.",
  "heat_profile_selection": {
    "full_nonlinear_Lorentzian_BV_action_claimed": false,
    "overall_positive_trace_amplitude_relevant_to_ratio": false,
    "profile": "chi_s(x)=exp(-s x)",
    "selection_routes": [
      "spectral functional calculus of the selected generator K",
      "continuous semigroup law plus infinitesimal generator -x"
    ],
    "shape_parameters_remaining": 0,
    "spectral_coordinate": "x in spec(K), x>=0"
  },
  "parameter_ledger": {
    "absolute_dimensionful_scale_selected": false,
    "conditional_physical_clock_hypotheses": 2,
    "inherited_internal_checkpoint_parameters": 0,
    "inherited_universal_metrology_primitives": 1,
    "new_continuous_profile_parameters": 0,
    "new_fitted_coefficients": 0,
    "new_observed_construction_inputs": 0,
    "new_sector_specific_scales": 0
  },
  "physical_boundary": {
    "B_ACTION_01_closed": false,
    "B_QFT_02_closed": false,
    "B_SM_02_closed": false,
    "absolute_scale_closed": false,
    "additive_physical_clock_lift_closed_unconditionally": false,
    "cutoff_unit_radial_values_closed_at_declared_tier": true,
    "full_four_dimensional_determinant_closed": false,
    "full_upper_physical_source_closed": false,
    "held_out_observable_closed": false,
    "loop_RG_threshold_pole_transport_closed": false,
    "nine_charged_Yukawa_values_closed": false,
    "one_atom_measure_closed_at_declared_tier": true,
    "radial_moment_ratio_closed_at_declared_tier": true,
    "renormalized_QFT_vacuum_closed": false,
    "same_root_direct_source_diagram_closed": true,
    "sector_generation_map_closed": false,
    "state_space_heat_profile_closed": true
  },
  "physical_packets_accepted": 0,
  "physical_packets_total": 3,
  "physical_rows_accepted": 0,
  "physical_rows_total": 7,
  "positive_laplace_measure": {
    "A53_one_atom_measure_promoted_at_declared_tier": true,
    "minimal_support_axiom_used": false,
    "proof_device": "positive exponential tilt at x0>0",
    "tilted_mean": "E[u]=s",
    "tilted_variance": "Var(u)=0",
    "transform": "int exp(-u x)dmu(u)=A exp(-s x)",
    "unique_measure": "mu=A delta_s"
  },
  "promoted_radial_values": {
    "R_star": {
      "exact_coefficients": {
        "rational": "3106/4393",
        "sqrt13": "4/4393"
      },
      "expression": "(3106+4sqrt(13))/4393",
      "interval": {
        "lower_decimal": "0.710316914432473470788180488293",
        "lower_exact": "487565969547164993308199513292169059966407/686406250000000000000000000000000000000000",
        "upper_decimal": "0.710316914432473470788180488293",
        "upper_exact": "7801055512754639892931192212674704959462513/10982500000000000000000000000000000000000000"
      }
    },
    "branch_values_over_Lambda": {
      "-2": {
        "expression": "(5+sqrt(13))/6 sqrt(15(3106+4sqrt(13))/(4393log(448)))",
        "interval": {
          "lower_decimal": "1.894801301948269560173742413384",
          "lower_exact": "23685016274353369502171780167297423364292372234812250045794939135979/12500000000000000000000000000000000000000000000000000000000000000000",
          "upper_decimal": "1.894801301948269560173742413385",
          "upper_exact": "113688078116896173610424544803113687661359347721659367900984136926240813/60000000000000000000000000000000000000000000000000000000000000000000000"
        }
      },
      "-4": {
        "expression": "(2+sqrt(13))/3 sqrt(15(3106+4sqrt(13))/(4393log(448)))",
        "interval": {
          "lower_decimal": "2.468500974521070626623370747668",
          "lower_exact": "15428131090756691416396067172922423364292372234812250045794939135979/6250000000000000000000000000000000000000000000000000000000000000000",
          "upper_decimal": "2.468500974521070626623370747669",
          "upper_exact": "74055029235632118798701122430083687661359347721659367900984136926240813/30000000000000000000000000000000000000000000000000000000000000000000000"
        }
      },
      "2": {
        "expression": "(7-sqrt(13))/6 sqrt(15(3106+4sqrt(13))/(4393log(448)))",
        "interval": {
          "lower_decimal": "0.747401956802667427274485744816",
          "lower_exact": "149480391360533485454897148963241226171317640570906081038968560110739/200000000000000000000000000000000000000000000000000000000000000000000",
          "upper_decimal": "0.747401956802667427274485744817",
          "upper_exact": "934252446003334284093107181020964840388374445416041824323116399746631/1250000000000000000000000000000000000000000000000000000000000000000000"
        }
      }
    },
    "h_over_Lambda": "sqrt(15(3106+4sqrt(13))/(4393log(448)))",
    "h_over_Lambda_interval": {
      "lower_decimal": "1.321101629375468493724114079100",
      "lower_exact": "13211016293754684937241140791/10000000000000000000000000000",
      "upper_decimal": "1.321101629375468493724114079101",
      "upper_exact": "1321101629375468493724114079101/1000000000000000000000000000000"
    },
    "h_squared_over_Lambda_squared": "15(3106+4sqrt(13))/(4393log(448))",
    "h_squared_over_Lambda_squared_interval": {
      "lower_decimal": "1.745309515138517718535183362742",